00:00.0 0600: 8086:1237 (rev 02)
	Subsystem: 1af4:1100
	Control: I/O+ Mem+ BusMaster- SpecCycle- MemWINV- VGASnoop- ParErr- Stepping- SERR+ FastB2B- DisINTx-
	Status: Cap- 66MHz- UDF- FastB2B- ParErr- DEVSEL=fast >TAbort- <TAbort- <MAbort- >SERR- <PERR- INTx-

00:01.0 0601: 8086:7000
	Subsystem: 1af4:1100
	Physical Slot: 1
	Control: I/O+ Mem+ BusMaster- SpecCycle- MemWINV- VGASnoop- ParErr- Stepping- SERR+ FastB2B- DisINTx-
	Status: Cap- 66MHz- UDF- FastB2B- ParErr- DEVSEL=medium >TAbort- <TAbort- <MAbort- >SERR- <PERR- INTx-

00:01.1 0101: 8086:7010 (prog-if 80 [ISA Compatibility mode-only controller, supports bus mastering])
	Subsystem: 1af4:1100
	Physical Slot: 1
	Control: I/O+ Mem+ BusMaster+ SpecCycle- MemWINV- VGASnoop- ParErr- Stepping- SERR+ FastB2B- DisINTx-
	Status: Cap- 66MHz- UDF- FastB2B+ ParErr- DEVSEL=medium >TAbort- <TAbort- <MAbort- >SERR- <PERR- INTx-
	Latency: 0
	Region 0: Memory at 000001f0 (32-bit, non-prefetchable) [virtual] [size=8]
	Region 1: Memory at 000003f0 (type 3, non-prefetchable) [virtual]
	Region 2: Memory at 00000170 (32-bit, non-prefetchable) [virtual] [size=8]
	Region 3: Memory at 00000370 (type 3, non-prefetchable) [virtual]
	Region 4: I/O ports at c120 [virtual] [size=16]
	Kernel driver in use: ata_piix
	Kernel modules: ata_piix, ata_generic

00:01.2 0c03: 8086:7020 (rev 01) (prog-if 00 [UHCI])
	Subsystem: 1af4:1100
	Physical Slot: 1
	Control: I/O+ Mem+ BusMaster+ SpecCycle- MemWINV- VGASnoop- ParErr- Stepping- SERR+ FastB2B- DisINTx-
	Status: Cap- 66MHz- UDF- FastB2B- ParErr- DEVSEL=fast >TAbort- <TAbort- <MAbort- >SERR- <PERR- INTx-
	Latency: 0
	Interrupt: pin D routed to IRQ 11
	Region 4: I/O ports at c100 [size=32]
	Kernel driver in use: uhci_hcd

00:01.3 0680: 8086:7113 (rev 03)
	Subsystem: 1af4:1100
	Physical Slot: 1
	Control: I/O+ Mem+ BusMaster- SpecCycle- MemWINV- VGASnoop- ParErr- Stepping- SERR+ FastB2B- DisINTx-
	Status: Cap- 66MHz- UDF- FastB2B+ ParErr- DEVSEL=medium >TAbort- <TAbort- <MAbort- >SERR- <PERR- INTx-
	Interrupt: pin A routed to IRQ 9
	Kernel driver in use: piix4_smbus
	Kernel modules: i2c_piix4

00:02.0 0300: 1013:00b8 (prog-if 00 [VGA controller])
	Subsystem: 1af4:1100
	Control: I/O+ Mem+ BusMaster- SpecCycle- MemWINV- VGASnoop- ParErr- Stepping- SERR+ FastB2B- DisINTx-
	Status: Cap- 66MHz- UDF- FastB2B- ParErr- DEVSEL=fast >TAbort- <TAbort- <MAbort- >SERR- <PERR- INTx-
	Region 0: Memory at fc000000 (32-bit, prefetchable) [size=32M]
	Region 1: Memory at feb90000 (32-bit, non-prefetchable) [size=4K]
	Expansion ROM at 000c0000 [disabled] [size=128K]
	Kernel driver in use: cirrus
	Kernel modules: cirrus

00:03.0 0200: 1af4:1000
	Subsystem: 1af4:0001
	Physical Slot: 3
	Control: I/O+ Mem+ BusMaster+ SpecCycle- MemWINV- VGASnoop- ParErr- Stepping- SERR+ FastB2B- DisINTx+
	Status: Cap+ 66MHz- UDF- FastB2B- ParErr- DEVSEL=fast >TAbort- <TAbort- <MAbort- >SERR- <PERR- INTx-
	Latency: 0
	Interrupt: pin A routed to IRQ 10
	Region 0: I/O ports at c080 [size=64]
	Region 1: Memory at feb91000 (32-bit, non-prefetchable) [size=4K]
	Region 4: Memory at c000000000 (64-bit, prefetchable) [size=16K]
	Expansion ROM at feb00000 [disabled] [size=512K]
	Capabilities: <access denied>
	Kernel driver in use: virtio-pci

00:04.0 0100: 1af4:1001
	Subsystem: 1af4:0002
	Physical Slot: 4
	Control: I/O+ Mem+ BusMaster+ SpecCycle- MemWINV- VGASnoop- ParErr- Stepping- SERR+ FastB2B- DisINTx+
	Status: Cap+ 66MHz- UDF- FastB2B- ParErr- DEVSEL=fast >TAbort- <TAbort- <MAbort- >SERR- <PERR- INTx-
	Latency: 0
	Interrupt: pin A routed to IRQ 11
	Region 0: I/O ports at c000 [size=128]
	Region 1: Memory at feb92000 (32-bit, non-prefetchable) [size=4K]
	Region 4: Memory at c000004000 (64-bit, prefetchable) [size=16K]
	Capabilities: <access denied>
	Kernel driver in use: virtio-pci

00:05.0 00ff: 1af4:1002
	Subsystem: 1af4:0005
	Physical Slot: 5
	Control: I/O+ Mem+ BusMaster+ SpecCycle- MemWINV- VGASnoop- ParErr- Stepping- SERR+ FastB2B- DisINTx-
	Status: Cap+ 66MHz- UDF- FastB2B- ParErr- DEVSEL=fast >TAbort- <TAbort- <MAbort- >SERR- <PERR- INTx-
	Latency: 0
	Interrupt: pin A routed to IRQ 10
	Region 0: I/O ports at c0c0 [size=64]
	Region 4: Memory at c000008000 (64-bit, prefetchable) [size=16K]
	Capabilities: <access denied>
	Kernel driver in use: virtio-pci

